{
  "name": "zapier",
  "owner": {
    "name": "Zapier",
    "email": "support@zapier.com"
  },
  "metadata": {
    "description": "Official Zapier plugins for Cursor - connect your AI to 9,000+ apps via the Model Context Protocol",
    "version": "1.0.0"
  },
  "plugins": [
    {
      "name": "zapier",
      "description": "Connect 9,000+ apps to your AI workflow. Discover, enable, and execute Zapier actions directly from your client.",
      "source": {
        "source": "git-subdir",
        "url": "https://github.com/zapier/zapier-mcp.git",
        "path": "plugins/zapier",
        "ref": "main"
      }
    }
  ]
}
